{
  "$schema": "https://json-schema.org/draft/2020-12/schema",
  "$id": "https://opifex-templates.dev/schemas/catalog-v1.json",
  "title": "Opifex Template Catalog",
  "type": "object",
  "required": ["name", "templates"],
  "properties": {
    "name": { "type": "string" },
    "description": { "type": "string" },
    "version": { "type": "string" },
    "templates": {
      "type": "array",
      "items": {
        "type": "object",
        "required": ["id", "name", "version"],
        "properties": {
          "id": { "type": "string" },
          "name": { "type": "string" },
          "description": { "type": "string" },
          "version": { "type": "string" },
          "author": { "type": "string" },
          "downloadUrl": { "type": "string", "format": "uri" },
          "checksum": { "type": "string", "pattern": "^sha256:[0-9a-f]{64}$" },
          "specJson": {},
          "model": { "type": "string" },
          "isStarter": { "type": "boolean" }
        }
      }
    }
  }
}
